{
  "schema_version": "1.0.0",
  "id": "render_hifi",
  "kind": "substrate_component",
  "name": "render_hifi",
  "path": "notebooks/inversion/survey/lib/hifi_render.py",
  "tier": "substrate",
  "interface": "(q0_wxyz, omega0_rad, ctx) -> hifi-lightcurve (N,): propagates attitude, computes shadows, runs generate_lightcurves. The survey's hi-fi forward evaluation at non-truth states (36 importers).  [in_use=True]",
  "current_version": "1.0.0",
  "current_hash": "sha256:0bfc827bb2c8a3f9",
  "canon": true,
  "variant_of": null,
  "promoted_from": null,
  "entry_point": "notebooks/inversion/survey/lib/hifi_render.py:render_hifi",
  "ports": {
    "input": [
      "q0-omega-state",
      "epoch-observation"
    ],
    "output": {
      "return": "hifi-lightcurve"
    }
  },
  "default_params": null,
  "versions": [
    {
      "version": "1.0.0",
      "hash": "sha256:0bfc827bb2c8a3f9",
      "changed_on": "2026-06-07",
      "change_reason": "Registered by the W-D laboratory scour (ADR-0007): de-facto Tool inventoried from code; entry_point resolved + hashed.",
      "is_bug_fix": false
    }
  ],
  "created_at": "2026-06-07T00:00:00Z",
  "updated_at": "2026-06-07T00:00:00Z"
}
