{
  "schema_version": "1.0.0",
  "id": "stl_load_satellite",
  "kind": "substrate_component",
  "name": "create_satellite_from_stl_config",
  "path": "src/io/stl_loader.py",
  "tier": "substrate",
  "interface": "(RSO_Config, config_manager) -> Satellite dataclass (Components/Facets/BRDF). The de-facto model-loader; produces the satellite-model every computation block consumes.  [in_use=True]",
  "current_version": "1.0.0",
  "current_hash": "sha256:64834a51c0dcce63",
  "canon": true,
  "variant_of": null,
  "promoted_from": null,
  "entry_point": "src/io/stl_loader.py:STLLoader.create_satellite_from_stl_config",
  "ports": {
    "input": [
      "satellite-model"
    ],
    "output": [
      "satellite-model"
    ]
  },
  "default_params": null,
  "versions": [
    {
      "version": "1.0.0",
      "hash": "sha256:64834a51c0dcce63",
      "changed_on": "2026-06-07",
      "change_reason": "Registered by the W-D laboratory scour (ADR-0007): de-facto Tool inventoried from code; entry_point resolved + hashed.",
      "is_bug_fix": false
    }
  ],
  "created_at": "2026-06-07T00:00:00Z",
  "updated_at": "2026-06-07T00:00:00Z"
}
