{
  "schema_version": "1.0.0",
  "id": "geo_filter",
  "kind": "substrate_component",
  "name": "geo_filter",
  "path": "notebooks/inversion/survey/lib/filter_costs.py",
  "tier": "substrate",
  "interface": "VARIANT: DIFFERENT METHOD/SIGNAL: scores body-frame PAB vs tier-allowed face normals at spec events (geometry-only, no surrogate magnitude) vs alignment's brightness-peak match. Distinct job within the same filter-scoring cluster. variant_of alignment-filter (or its own canon \u2014 borderline).  [in_use=False]",
  "current_version": "1.0.0",
  "current_hash": "sha256:057d6f8fd0fe8154",
  "canon": false,
  "variant_of": "alignment_filter",
  "promoted_from": null,
  "entry_point": "notebooks/inversion/survey/lib/filter_costs.py:geo_cost",
  "ports": {
    "input": [
      "light-curve",
      "anchor-epoch"
    ],
    "output": {
      "return": "filter"
    }
  },
  "default_params": null,
  "versions": [
    {
      "version": "1.0.0",
      "hash": "sha256:057d6f8fd0fe8154",
      "changed_on": "2026-06-07",
      "change_reason": "Registered by the W-D laboratory scour (ADR-0007): de-facto Tool inventoried from code; entry_point resolved + hashed.",
      "is_bug_fix": false
    }
  ],
  "created_at": "2026-06-07T00:00:00Z",
  "updated_at": "2026-06-07T00:00:00Z"
}
