{
  "schema_version": "1.0.0",
  "id": "create_3d_animation",
  "kind": "substrate_component",
  "name": "create_interactive_3d_animation",
  "path": "src/visualization/plotly_animation_generator.py",
  "tier": "substrate",
  "interface": "(animation_data, magnitudes, time_hours, geometry_data, satellite_name) -> Plotly HTML animation on disk; color_mode lit_status|flux.  [in_use=False]",
  "current_version": "1.0.0",
  "current_hash": "sha256:ee6f8b7e664cb8a4",
  "canon": true,
  "variant_of": null,
  "promoted_from": null,
  "entry_point": "src/visualization/plotly_animation_generator.py:create_interactive_3d_animation",
  "ports": {
    "input": [
      "attitude-trajectory",
      "hifi-lightcurve"
    ],
    "output": [
      "attitude-animation"
    ]
  },
  "default_params": {
    "color_mode": "lit_status",
    "frame_duration_ms": 100
  },
  "versions": [
    {
      "version": "1.0.0",
      "hash": "sha256:ee6f8b7e664cb8a4",
      "changed_on": "2026-06-07",
      "change_reason": "Registered by the W-D laboratory scour (ADR-0007): de-facto Tool inventoried from code; entry_point resolved + hashed.",
      "is_bug_fix": false
    }
  ],
  "created_at": "2026-06-07T00:00:00Z",
  "updated_at": "2026-06-07T00:00:00Z"
}
